<?xml version="1.0" encoding="UTF-8"?>
<in_game_shop xmlns:xsi="http://www.w3.org/2001/XMLSchema-instance" xsi:noNamespaceSchemaLocation="in_game_shop.xsd">
	<!-- can be more category -->
	<category id="0" name="ELYOS">
		<sub_category id="3" name="Clothing" />
		<sub_category id="4" name="Hats" />
		<sub_category id="5" name="Food" />
		<sub_category id="6" name="Drinks" />
		<sub_category id="7" name="Paint" />
		<sub_category id="8" name="Titles" />
		<sub_category id="9" name="Modifications" />
		<sub_category id="10" name="Modifications of wea" />
		<sub_category id="11" name="Pets" />
		<sub_category id="12" name="Wings" />
		<sub_category id="13" name="Recipes" />
		<sub_category id="14" name="Items collection" />
		<sub_category id="15" name="Miscellaneous" />
		<sub_category id="16" name="Asmodian hairstyles" />
		<sub_category id="17" name="Elyos hairstyles" />
		<sub_category id="18" name="Potions" />
		<sub_category id="19" name="Emotions" />
	</category>
	<category id="1" name="ASMODIANS">
		<sub_category id="3" name="Clothing" />
		<sub_category id="4" name="Hats" />
		<sub_category id="5" name="Food" />
		<sub_category id="6" name="Drinks" />
		<sub_category id="7" name="Paint" />
		<sub_category id="8" name="Titles" />
		<sub_category id="9" name="Modifications" />
		<sub_category id="10" name="Modifications of wea" />
		<sub_category id="11" name="Pets" />
		<sub_category id="12" name="Wings" />
		<sub_category id="13" name="Recipes" />
		<sub_category id="14" name="Items collection" />
		<sub_category id="15" name="Miscellaneous" />
		<sub_category id="16" name="Asmodian hairstyles" />
		<sub_category id="17" name="Elyos hairstyles" />
		<sub_category id="18" name="Potions" />
		<sub_category id="19" name="Emotions" />
	</category>
</in_game_shop>